<?xml version="1.0"?>
<!DOCTYPE UserSecurity SYSTEM "..\menu.dtd">
<UserSecurity>
	<FitMenu>
		<Description>Web Menu</Description>
	</FitMenu>
	<AllowedCommands>
		<Command id="DO_POLICY_ENQUIRY"></Command>
		<Command id="EXPORT_POLICY_LIST"></Command>
		<Command id="POLICY_ENQUIRY"></Command>
		<Command id="DO_SHOW_POLICY"></Command>
		<Command id="POLICY_ACTIVITY"></Command>
		<Command id="SHOW_ONLINE_CC_PAYMENT"></Command>
		<Command id="PROCESS_ONLINE_CC_PAYMENT"></Command>
		<Command id="UNIT_MOVEMENTS"></Command>
		<Command id="UNIT_STATEMENT"></Command>
		<Command id="SHOW_ALL_POLICY_COMMISSIONS"></Command>
		<Command id="DO_SHOW_POLICY_FUND"></Command>
		<Command id="DO_HOME"></Command>
		<Command id="DO_SHOW_AGENT_STATEMENTS"></Command>
		<Command id="DO_SHOW_AGENT_STMT_DOCS"></Command>
		<Command id="LOGOUT"></Command>
		<Command id="SHOW_POLICY_FUND"></Command>
		<Command id="SHOW_DOC_IMAGE"></Command>
		<Command id="SHOW_BATCH_STATUS"></Command>
		<Command id="DO_ADMINISTRATION"></Command>
		<Command id="ADMINISTRATION"></Command>
		<Command id="CONFIGURATION"></Command>
		<Command id="SERGUEI_SPOOL"></Command>
		<Command id="SET_CURRENT_DATE"></Command>
		<Command id="EXISTING_QUOTES"></Command>
		<Command id="NEW_QUOTE"></Command>
		<Command id="NEW_BUSINESS"></Command>
		<Command id="DO_NEW_BUSINESS"></Command>
		<Command id="DO_GROUP_BUSINESS"></Command>
		<Command id="SHOW_GROUP"></Command>
		<Command id="SHOW_SUBGROUP"></Command>
		<Command id="SHOW_MEMBER_LIST"></Command>
		<Command id="GROUP_DATA"></Command>
		<Command id="SUBGROUP_DATA"></Command>
		<Command id="PROCESS_GROUP_BILL"></Command>
		<Command id="GROUP_BILL_SUMMARY"></Command>
		<Command id="GROUP_PREMIUMS"></Command>
		<Command id="UPLOAD_GROUP_BILL"></Command>
		<Command id="GROUP_SEARCH"></Command>
		<Command id="SELECT_AGENT"></Command>
		<Command id="PROCESS_SELECT_AGENT"></Command>
		<Command id="PROCESS_DISCLAIMER"></Command>
		<Command id="SHOW_POLICY_IMAGES"></Command>
		<Command id="SHOW_GROUP_IMAGES"></Command>
		<Command id="SHOW_DOC_IMAGE"></Command>
		<Command id="PROCESS_GROUP_QUOTE_SETUP"></Command>
		<Command id="SHOW_QUOTE_MEMBER_LIST"></Command>
		<Command id="GROUP_QUOTE_MEMBER_LIST"></Command>
		<Command id="GROUP_QUOTE_MEMBER"></Command>
		<Command id="SHOW_GROUP_QUOTE_MEMBER"></Command>
		<Command id="SHOW_GROUP_QUOTE"></Command>
		<Command id="SHOW_GROUP_QUOTE_SUBGROUP"></Command>
		<Command id="PROCESS_GROUP_QUOTE_SUBGROUP"></Command>
		<Command id="EXISTING_GROUP_QUOTES"></Command>
		<Command id="CLIENT_GROUP_QUOTE_LIST"></Command>
		<Command id="DOWNLOAD_SPOOL"></Command>
		<Command id="RUNNING_PROCESS"></Command>
		<Command id="IMPORT_QUOTE_MEMBERS"></Command>
		<Command id="LIST_CITIES"></Command>
		<Command id="MEMBER_LIST"></Command>
		<Command id="EDIT_MEMBER"></Command>
		<Command id="SHOW_MEMBER"></Command>
		<Command id="PROCESS_MEMBER"></Command>
		<Command id="GROUP_MEMBER_QUOTE"></Command>
		<Command id="GROUP_MEMBER_QUOTE_POST_ISSUE"></Command>
		<Command id="GROUP_MEMBER_LEAVE"></Command>
		<Command id="IMPORT_GROUP_MEMBERS"></Command>
		<Command id="EXPORT_GROUP_MEMBERS"></Command>
		<Command id="SHOW_FUND_SPLIT"></Command>
		<Command id="CHANGE_FUND_SPLIT"></Command>
		<Command id="SHOW_TBMVR_RATES"></Command>
		<Command id="CHANGE_TBMVR_RATES"></Command>
		<Command id="SHOW_POLICY_VALUE"></Command>
		<Command id="SWITCH_UNITS"></Command>
		<Command id="PROCESS_SWITCH_UNITS"></Command>
		<Command id="DO_SHOW_AGENT_PREMIUMS"></Command>
		<Command id="SHOW_AGENT_PREMIUMS"></Command>
		<Command id="DO_SHOW_AGENT_RECEIPTS"></Command>
		<Command id="SHOW_AGENT_RECEIPTS"></Command>
		<Command id="DO_SHOW_AGENT_LOANS"></Command>
		<Command id="DO_SHOW_AGENT_LOAN_TRANS"></Command>
		<Command id="DOWNLOAD_OUTSTANDING_PREMIUMS_BY_DATE"></Command>
		<Command id="DOWNLOAD_OUTSTANDING_PREMIUMS_BY_DATE_DO"></Command>
		<Command id="USER_HOME"></Command>
		<Command id="SELECT_FUND_LIST"></Command>
		<Command id="DO_CHANGE_PASSWORD"></Command>
		<Command id="CHANGE_PASSWORD"></Command>
		<Command id="SHOW_POLICY_VALUE_GRAPH"></Command>
		<Command id="SHOW_POLICY_VALUE_GRAPH_CHOOSE"></Command>
		<Command id="SHOW_POLICY_VALUE_GRAPH_IMG"></Command>
		<Command id="SHOW_FUND_SPLIT_PIE"></Command>
		<Command id="MEMBER_CHANGE_LIST"></Command>
		<Command id="BLOCKED_USERS_LIST"></Command>
		<Command id="DO_CLIENT_ENQUIRY"></Command>
		<Command id="DO_SHOW_CLIENT"></Command>
		<Command id="PREMIUM_STATEMENT"></Command>
		<Command id="DO_CONTACT_CS"></Command>
		<Command id="PROCESS_CONTACT_CS"></Command>
		<Command id="CREATE_BANK_ACCOUNT"></Command>
		<Command id="PROCESS_BANK_ACCOUNT"></Command>
		<Command id="DO_OTP"></Command>
		<Command id="RESEND_OTP"></Command>
	</AllowedCommands>
	<PolicyMaintenanceButtons />
	<GroupSchemeMaintenanceButtons />
    <ClientButtons/>
	<AllowedCommandsOther />
</UserSecurity>
